{
  "$schema": "https://json-schema.org/draft/2020-12/schema",
  "title": "Theme Definition",
  "type": "object",
  "required": ["scripts"],
  "properties": {
    "apiVersion": {
      "type": "string",
      "pattern": "^[0-9]+\\.[0-9]+$",
      "default": "1.0",
      "description": "Required theme API major and minimum minor version. Omission means 1.0."
    },
    "scripts": {
      "type": "object",
      "additionalProperties": { "type": "string" }
    },
    "settings": {
      "type": "object",
      "additionalProperties": { "type": "string" }
    },
    "translations": {
      "type": "object",
      "description": "Map of locale tags to compiled Qt translation files. Tags use language, optional script, and optional territory subtags (for example en, zh-Hans, or zh-Hant-HK). Hyphens are preferred; underscores are accepted for compatibility.",
      "propertyNames": {
        "pattern": "^[A-Za-z]{2,3}(?:[-_][A-Za-z]{4})?(?:[-_](?:[A-Za-z]{2}|[0-9]{3}))?$"
      },
      "additionalProperties": { "type": "string" }
    },
    "settingsScripts": {
      "type": "object",
      "additionalProperties": { "type": "string" }
    }
  }
}
