{
  "apiVersion": "1.0",
  "$schema": "https://raw.githubusercontent.com/Bobini1/RhythmGame/refs/heads/master/schemas/theme.json",
  "scripts": {
    "k7": "scripts/gameplay/Gameplay.qml",
    "k7battle": "scripts/gameplay/Gameplay.qml",
    "k14": "scripts/gameplay/Gameplay.qml",
    "main": "scripts/main/Main.qml",
    "multiplayer": "scripts/multiplayer/Multiplayer.qml",
    "select": "scripts/select/Select.qml",
    "settings": "scripts/settings/Settings.qml",
    "result": "scripts/result/Result.qml",
    "courseResult": "scripts/result/CourseResult.qml",
    "decide": "scripts/decide/Decide.qml"
  },
  "settings": {
    "k7": "settings/k7.json",
    "k7battle": "settings/k7battle.json",
    "k14": "settings/k14.json",
    "main": "settings/main.json",
    "settings": "settings/settings.json",
    "select": "settings/select.json",
    "decide": "settings/decide.json",
    "result": "settings/result.json"
  },
  "translations": {
    "en": "translations/Default_en.qm",
    "pl": "translations/Default_pl.qm",
    "zh": "translations/Default_zh_CN.qm"
  }
}
